{
  "$schema": "../schema/traca.visual-functional-dictionary.schema.v0.2.json",
  "meta": {
    "id": "TRACA_visual_functional_dictionary",
    "version": "0.2.0",
    "status": "operational_with_audited_inventory",
    "reported_inventory_evidence_count": 103,
    "imported_inventory_evidence_count": 103,
    "limitation": "S'han importat i classificat les 103 evidències de l'inventari. Les evidències candidates, ambigües o superades es conserven per traçabilitat però no poden omplir slots obligatoris ni generar geometria."
  },
  "authority_order": [
    "coach_validated",
    "graphic_legend",
    "canonical_validated",
    "semantic_validated",
    "spatial_validated",
    "repeated_observation",
    "candidate",
    "inference"
  ],
  "canonical_visual_reference": [
    {
      "id": "CVR_ATTACKER",
      "concept": "attacker",
      "label": "Atacant",
      "dictionary_ref": "VF_ATTACKER",
      "source_refs": ["SRC_COACH_GRAPHIC_LEGEND"],
      "evidence_refs": ["E_LEGEND_ATTACKER"],
      "status": "validated"
    },
    {
      "id": "CVR_ATTACKER_WITH_BALL",
      "concept": "attacker_with_ball",
      "label": "Atacant amb pilota",
      "dictionary_ref": "VF_ATTACKER_WITH_BALL",
      "source_refs": ["SRC_COACH_GRAPHIC_LEGEND"],
      "evidence_refs": ["E_LEGEND_BALL_OWNER"],
      "status": "validated"
    },
    {
      "id": "CVR_DEFENDER",
      "concept": "defender",
      "label": "Defensor",
      "dictionary_ref": "VF_DEFENDER",
      "source_refs": ["SRC_COACH_GRAPHIC_LEGEND"],
      "evidence_refs": ["E_LEGEND_DEFENDER"],
      "status": "validated"
    },
    {
      "id": "CVR_MOVEMENT_WITHOUT_BALL",
      "concept": "movement_without_ball",
      "label": "Desplaçament sense pilota",
      "dictionary_ref": "VF_MOVEMENT_WITHOUT_BALL",
      "source_refs": ["SRC_COACH_GRAPHIC_LEGEND"],
      "evidence_refs": ["E_LEGEND_MOVEMENT"],
      "status": "validated"
    },
    {
      "id": "CVR_PASS",
      "concept": "pass",
      "label": "Passada",
      "dictionary_ref": "VF_PASS",
      "source_refs": ["SRC_COACH_GRAPHIC_LEGEND"],
      "evidence_refs": ["E_LEGEND_PASS"],
      "status": "validated"
    },
    {
      "id": "CVR_PASS_FEINT",
      "concept": "pass_feint",
      "label": "Finta de passada",
      "dictionary_ref": "VF_PASS_FEINT",
      "source_refs": ["SRC_COACH_GRAPHIC_LEGEND"],
      "evidence_refs": ["E_LEGEND_PASS_FEINT"],
      "status": "validated"
    },
    {
      "id": "CVR_SHOT",
      "concept": "shot",
      "label": "Llançament",
      "dictionary_ref": "VF_SHOT",
      "source_refs": ["SRC_COACH_GRAPHIC_LEGEND"],
      "evidence_refs": ["E_LEGEND_SHOT"],
      "status": "validated"
    },
    {
      "id": "CVR_SHOT_FEINT",
      "concept": "shot_feint",
      "label": "Finta de llançament",
      "dictionary_ref": "VF_SHOT_FEINT",
      "source_refs": ["SRC_COACH_GRAPHIC_LEGEND"],
      "evidence_refs": ["E_LEGEND_SHOT_FEINT"],
      "status": "validated"
    },
    {
      "id": "CVR_FEINT",
      "concept": "feint",
      "label": "Finta",
      "dictionary_ref": "VF_FEINT",
      "source_refs": ["SRC_COACH_GRAPHIC_LEGEND"],
      "evidence_refs": ["E_LEGEND_FEINT"],
      "status": "validated"
    },
    {
      "id": "CVR_BLOCK_SCREEN",
      "concept": "block_screen",
      "label": "Bloqueig ofensiu / pantalla",
      "dictionary_ref": "VF_BLOCK_SCREEN",
      "source_refs": ["SRC_COACH_GRAPHIC_LEGEND"],
      "evidence_refs": ["E_LEGEND_BLOCK"],
      "status": "validated"
    },
    {
      "id": "CVR_DEFENSIVE_BLOCK",
      "concept": "defensive_block",
      "label": "Blocatge defensiu",
      "dictionary_ref": "VF_DEFENSIVE_BLOCK",
      "source_refs": ["SRC_COACH_GRAPHIC_LEGEND"],
      "evidence_refs": ["E_LEGEND_DEFENSIVE_BLOCK"],
      "status": "validated"
    },
    {
      "id": "CVR_FUTURE_POSITION",
      "concept": "future_position",
      "label": "Posició futura",
      "dictionary_ref": "VF_TEMPORAL_STATE",
      "source_refs": ["SRC_COACH_GRAPHIC_LEGEND"],
      "evidence_refs": ["E_LEGEND_TEMPORAL_STATE"],
      "status": "validated"
    },
    {
      "id": "CVR_PAST_POSITION",
      "concept": "past_position",
      "label": "Posició anterior",
      "dictionary_ref": "VF_TEMPORAL_STATE",
      "source_refs": ["SRC_COACH_GRAPHIC_LEGEND"],
      "evidence_refs": ["E_LEGEND_TEMPORAL_STATE"],
      "status": "validated"
    },
    {
      "id": "CVR_DRIBBLE",
      "concept": "dribble",
      "label": "Desplaçament en bot",
      "dictionary_ref": "VF_DRIBBLE",
      "source_refs": ["SRC_COACH_GRAPHIC_LEGEND"],
      "evidence_refs": ["E_LEGEND_DRIBBLE"],
      "status": "validated"
    }
  ],
  "sources": [
    {
      "id": "SRC_COACH_ITERATION_2026_08_11",
      "authority": "coach_validated",
      "status": "available",
      "ref": "coach_instruction:2026-08-11#visual-functional-dictionary"
    },
    {
      "id": "SRC_INVENTORY_REPRESENTATIONS_V0_1",
      "authority": "repeated_observation",
      "status": "available",
      "ref": "coach_attachment:INVENTARI_DE_REPRESENTACIONS_TRACA.md",
      "reported_evidence_count": 103,
      "imported_evidence_count": 103
    },
    {
      "id": "SRC_COACH_GRAPHIC_LEGEND",
      "authority": "graphic_legend",
      "status": "available",
      "ref": "coach_attachment:AEB796E5-F49A-4466-A62E-79AA36F44AD4.png"
    }
  ],
  "evidence": [
    {
      "id": "E_COACH_ATTACKER",
      "source_ref": "SRC_COACH_ITERATION_2026_08_11",
      "statement": "Atacant: cercle de contorn continu."
    },
    {
      "id": "E_COACH_BALL_OWNER",
      "source_ref": "SRC_COACH_ITERATION_2026_08_11",
      "statement": "Atacant amb pilota: atacant més pilota adjacent."
    },
    {
      "id": "E_COACH_DEFENDER",
      "source_ref": "SRC_COACH_ITERATION_2026_08_11",
      "statement": "Defensor: triangle de contorn continu."
    },
    {
      "id": "E_COACH_MOVEMENT",
      "source_ref": "SRC_COACH_ITERATION_2026_08_11",
      "statement": "Moviment sense pilota: línia contínua amb fletxa."
    },
    {
      "id": "E_COACH_PASS",
      "source_ref": "SRC_COACH_ITERATION_2026_08_11",
      "statement": "Passada: línia discontínua amb fletxa."
    },
    {
      "id": "E_COACH_PASS_FEINT",
      "source_ref": "SRC_COACH_ITERATION_2026_08_11",
      "statement": "Finta de passada: passada discontínua amb marca obliqua."
    },
    {
      "id": "E_COACH_SHOT",
      "source_ref": "SRC_COACH_ITERATION_2026_08_11",
      "statement": "Llançament: fletxa reforçada de doble traç."
    },
    {
      "id": "E_COACH_SHOT_FEINT",
      "source_ref": "SRC_COACH_ITERATION_2026_08_11",
      "statement": "Finta de llançament: llançament amb marca obliqua."
    },
    {
      "id": "E_COACH_FEINT",
      "source_ref": "SRC_COACH_ITERATION_2026_08_11",
      "statement": "Finta: trajectòria amb canvi de direcció perceptible i fletxa."
    },
    {
      "id": "E_COACH_BLOCK",
      "source_ref": "SRC_COACH_ITERATION_2026_08_11",
      "statement": "Bloqueig o pantalla: atacant amb marca perpendicular pròxima a la relació bloquejada."
    },
    {
      "id": "E_COACH_DEFENSIVE_BLOCK",
      "source_ref": "SRC_COACH_ITERATION_2026_08_11",
      "statement": "Blocatge: defensor, recorregut i marca perpendicular final."
    },
    {
      "id": "E_COACH_TEMPORAL_STATE",
      "source_ref": "SRC_COACH_ITERATION_2026_08_11",
      "statement": "Posició abans o després: contorn discontinu del participant."
    },
    {
      "id": "E_COACH_DRIBBLE",
      "source_ref": "SRC_COACH_ITERATION_2026_08_11",
      "statement": "Desplaçament en bot: trajectòria ondulada amb fletxa."
    },
    {
      "id": "E_COACH_NO_GLYPH_2X1",
      "source_ref": "SRC_COACH_ITERATION_2026_08_11",
      "statement": "El 2x1 es compon amb participants i accions; no té glif propi."
    },
    {
      "id": "E_COACH_RELATIONAL_SPACE",
      "source_ref": "SRC_COACH_ITERATION_2026_08_11",
      "statement": "L'espai tàctic és una relació interna i no una primitiva visible."
    },
    {
      "id": "E_COACH_CROSSING",
      "source_ref": "SRC_COACH_ITERATION_2026_08_11",
      "statement": "L'encreuament és funcional: un jugador ataca l'espai contrari al del primer."
    },
    {
      "id": "E_COACH_PIVOT_SLIDE",
      "source_ref": "SRC_COACH_ITERATION_2026_08_11",
      "statement": "El lliscament del pivot és curt, lateral i manté relació amb 6 m."
    },
    {
      "id": "E_LEGEND_ATTACKER",
      "source_ref": "SRC_COACH_GRAPHIC_LEGEND",
      "statement": "Atacant: cercle de contorn continu."
    },
    {
      "id": "E_LEGEND_BALL_OWNER",
      "source_ref": "SRC_COACH_GRAPHIC_LEGEND",
      "statement": "Atacant amb pilota: cercle i punt petit adjacent."
    },
    {
      "id": "E_LEGEND_DEFENDER",
      "source_ref": "SRC_COACH_GRAPHIC_LEGEND",
      "statement": "Defensor: triangle de contorn continu."
    },
    {
      "id": "E_LEGEND_MOVEMENT",
      "source_ref": "SRC_COACH_GRAPHIC_LEGEND",
      "statement": "Desplaçament sense pilota: línia contínua amb fletxa."
    },
    {
      "id": "E_LEGEND_PASS",
      "source_ref": "SRC_COACH_GRAPHIC_LEGEND",
      "statement": "Passada: línia discontínua amb fletxa."
    },
    {
      "id": "E_LEGEND_PASS_FEINT",
      "source_ref": "SRC_COACH_GRAPHIC_LEGEND",
      "statement": "Finta de passada: passada discontínua amb marca obliqua curta."
    },
    {
      "id": "E_LEGEND_SHOT",
      "source_ref": "SRC_COACH_GRAPHIC_LEGEND",
      "statement": "Llançament a porteria: fletxa de doble traç continu."
    },
    {
      "id": "E_LEGEND_SHOT_FEINT",
      "source_ref": "SRC_COACH_GRAPHIC_LEGEND",
      "statement": "Finta de llançament: llançament amb marca obliqua curta."
    },
    {
      "id": "E_LEGEND_FEINT",
      "source_ref": "SRC_COACH_GRAPHIC_LEGEND",
      "statement": "Finta: trajectòria amb canvi de direcció perceptible i fletxa."
    },
    {
      "id": "E_LEGEND_BLOCK",
      "source_ref": "SRC_COACH_GRAPHIC_LEGEND",